{
  "case_id": "SP16-V14-FATIGUE-001",
  "standard": "СП 16.13330.2017",
  "action": "fatigue_design",
  "load_cycles": 1000000,
  "resonant_vortex_excitation": false,
  "annex_k_case_id": "K1-16-TRANSVERSE_WELD_SMOOTH",
  "normative_ultimate_resistance_n_mm2": 440.0,
  "maximum_signed_stress_n_mm2": 50.0,
  "minimum_signed_stress_n_mm2": -20.0,
  "design_ultimate_resistance_n_mm2": 400.0,
  "ultimate_resistance_safety_factor": 1.3,
  "net_section_stress_without_dynamic_and_stability_coefficients_confirmed": true,
  "same_loading_for_extreme_stresses_confirmed": true,
  "annex_k_case_selection_confirmed": true,
  "crane_group": "8K",
  "crane_in_metallurgical_shop": false,
  "crane_flange_connection_type": "welded",
  "crane_web_zone_state": "compression",
  "crane_sigma_x_n_mm2": 40.0,
  "crane_sigma_xy_n_mm2": 20.0,
  "crane_local_sigma_y_n_mm2": 10.0,
  "crane_flange_sigma_y_n_mm2": 5.0
}
